{
  "$schema": "https://json-schema.org/draft/2020-12/schema",
  "title": "devforge config",
  "type": "object",
  "additionalProperties": false,
  "required": ["stages"],
  "properties": {
    "stages": {
      "type": "object",
      "additionalProperties": false,
      "required": ["verify_request", "architect", "implementer", "reviewers", "final_reviewers"],
      "properties": {
        "verify_request": { "$ref": "#/$defs/stageValue" },
        "architect":   { "$ref": "#/$defs/stageValue" },
        "implementer": { "$ref": "#/$defs/stageValue" },
        "reviewers":       { "type": "array", "items": { "$ref": "#/$defs/stageValue" }, "minItems": 1 },
        "final_reviewers": { "type": "array", "items": { "$ref": "#/$defs/stageValue" }, "minItems": 0 }
      }
    },
    "oracle": {
      "type": "object",
      "additionalProperties": false,
      "properties": {
        "commands": {
          "type": "array",
          "items": { "type": "string", "minLength": 1 },
          "uniqueItems": true
        }
      }
    },
    "limits": {
      "type": "object",
      "additionalProperties": false,
      "properties": {
        "inner_iterations":    { "type": "integer", "minimum": 1 },
        "final_review_rounds": { "type": "integer", "minimum": 0 }
      }
    },
    "plan_mode_gate": { "type": "boolean" }
  },
  "$defs": {
    "stageValue": {
      "type": "object",
      "additionalProperties": false,
      "required": ["use"],
      "properties": {
        "use":   { "type": "string" },
        "model": { "type": "string" }
      }
    }
  }
}
