{
  "stages": {
    "verify_request": { "use": "brainstorming", "model": "opus" },
    "architect":   { "use": "writing-plans", "model": "opus" },
    "implementer": { "use": "feature-dev",   "model": "opus" },
    "reviewers": [
      { "use": "staff-review",  "model": "sonnet" }
    ],
    "final_reviewers": [
      { "use": "thermonuclear", "model": "sonnet" },
      { "use": "code-review",   "model": "sonnet" }
    ]
  },
  "oracle": {
    "commands": []
  },
  "limits": { "inner_iterations": 3, "final_review_rounds": 2 },
  "plan_mode_gate": true
}
